[
  {
    "entry_id": "STACK_CORE_00001",
    "match_type": "exact",
    "surface_form": "идеализации",
    "normalized_form": "идеализации",
    "language": "ru",
    "candidate_concept_ids": [
      "TFP_IDEALIZATION",
      "TFP_SPLITTING"
    ],
    "priority": 70,
    "version": "v0.6.0_ru_tfp_stack"
  },
  {
    "entry_id": "STACK_CORE_00002",
    "match_type": "exact",
    "surface_form": "идеализация",
    "normalized_form": "идеализация",
    "language": "ru",
    "candidate_concept_ids": [
      "TFP_IDEALIZATION",
      "TFP_SPLITTING"
    ],
    "priority": 70,
    "version": "v0.6.0_ru_tfp_stack"
  },
  {
    "entry_id": "STACK_CORE_00003",
    "match_type": "exact",
    "surface_form": "обесценивание",
    "normalized_form": "обесценивание",
    "language": "ru",
    "candidate_concept_ids": [
      "TFP_DEVALUATION",
      "TFP_SPLITTING"
    ],
    "priority": 70,
    "version": "v0.6.0_ru_tfp_stack"
  },
  {
    "entry_id": "STACK_CORE_00004",
    "match_type": "exact",
    "surface_form": "обесценивания",
    "normalized_form": "обесценивания",
    "language": "ru",
    "candidate_concept_ids": [
      "TFP_DEVALUATION",
      "TFP_SPLITTING"
    ],
    "priority": 70,
    "version": "v0.6.0_ru_tfp_stack"
  },
  {
    "entry_id": "STACK_CORE_00005",
    "match_type": "exact",
    "surface_form": "идеализированных",
    "normalized_form": "идеализированных",
    "language": "ru",
    "candidate_concept_ids": [
      "TFP_IDEALIZATION",
      "TFP_SPLITTING"
    ],
    "priority": 70,
    "version": "v0.6.0_ru_tfp_stack"
  },
  {
    "entry_id": "STACK_CORE_00006",
    "match_type": "exact",
    "surface_form": "идеализацию",
    "normalized_form": "идеализацию",
    "language": "ru",
    "candidate_concept_ids": [
      "TFP_IDEALIZATION",
      "TFP_SPLITTING"
    ],
    "priority": 70,
    "version": "v0.6.0_ru_tfp_stack"
  },
  {
    "entry_id": "STACK_CORE_00007",
    "match_type": "exact",
    "surface_form": "идеализацией",
    "normalized_form": "идеализацией",
    "language": "ru",
    "candidate_concept_ids": [
      "TFP_IDEALIZATION",
      "TFP_SPLITTING"
    ],
    "priority": 68,
    "version": "v0.6.0_ru_tfp_stack"
  },
  {
    "entry_id": "STACK_CORE_00008",
    "match_type": "exact",
    "surface_form": "идеализированные",
    "normalized_form": "идеализированные",
    "language": "ru",
    "candidate_concept_ids": [
      "TFP_IDEALIZATION",
      "TFP_SPLITTING"
    ],
    "priority": 68,
    "version": "v0.6.0_ru_tfp_stack"
  },
  {
    "entry_id": "STACK_CORE_00009",
    "match_type": "exact",
    "surface_form": "идеализированного",
    "normalized_form": "идеализированного",
    "language": "ru",
    "candidate_concept_ids": [
      "TFP_IDEALIZATION",
      "TFP_SPLITTING"
    ],
    "priority": 61,
    "version": "v0.6.0_ru_tfp_stack"
  },
  {
    "entry_id": "STACK_CORE_00010",
    "match_type": "phrase",
    "surface_form": "идеализации и",
    "normalized_form": "идеализации и",
    "language": "ru",
    "candidate_concept_ids": [
      "TFP_IDEALIZATION",
      "TFP_SPLITTING"
    ],
    "priority": 59,
    "version": "v0.6.0_ru_tfp_stack"
  },
  {
    "entry_id": "STACK_CORE_00011",
    "match_type": "exact",
    "surface_form": "идеализированным",
    "normalized_form": "идеализированным",
    "language": "ru",
    "candidate_concept_ids": [
      "TFP_IDEALIZATION",
      "TFP_SPLITTING"
    ],
    "priority": 59,
    "version": "v0.6.0_ru_tfp_stack"
  },
  {
    "entry_id": "STACK_CORE_00012",
    "match_type": "exact",
    "surface_form": "идеализированными",
    "normalized_form": "идеализированными",
    "language": "ru",
    "candidate_concept_ids": [
      "TFP_IDEALIZATION",
      "TFP_SPLITTING"
    ],
    "priority": 57,
    "version": "v0.6.0_ru_tfp_stack"
  },
  {
    "entry_id": "STACK_CORE_00013",
    "match_type": "exact",
    "surface_form": "обесценивать",
    "normalized_form": "обесценивать",
    "language": "ru",
    "candidate_concept_ids": [
      "TFP_DEVALUATION",
      "TFP_SPLITTING"
    ],
    "priority": 56,
    "version": "v0.6.0_ru_tfp_stack"
  },
  {
    "entry_id": "STACK_CORE_00014",
    "match_type": "phrase",
    "surface_form": "и обесценивания",
    "normalized_form": "и обесценивания",
    "language": "ru",
    "candidate_concept_ids": [
      "TFP_DEVALUATION",
      "TFP_SPLITTING"
    ],
    "priority": 55,
    "version": "v0.6.0_ru_tfp_stack"
  },
  {
    "entry_id": "STACK_CORE_00015",
    "match_type": "phrase",
    "surface_form": "идеализации в",
    "normalized_form": "идеализации в",
    "language": "ru",
    "candidate_concept_ids": [
      "TFP_IDEALIZATION",
      "TFP_SPLITTING"
    ],
    "priority": 53,
    "version": "v0.6.0_ru_tfp_stack"
  },
  {
    "entry_id": "STACK_CORE_00016",
    "match_type": "phrase",
    "surface_form": "к идеализации",
    "normalized_form": "к идеализации",
    "language": "ru",
    "candidate_concept_ids": [
      "TFP_IDEALIZATION",
      "TFP_SPLITTING"
    ],
    "priority": 53,
    "version": "v0.6.0_ru_tfp_stack"
  },
  {
    "entry_id": "STACK_CORE_00017",
    "match_type": "exact",
    "surface_form": "обесцениванию",
    "normalized_form": "обесцениванию",
    "language": "ru",
    "candidate_concept_ids": [
      "TFP_DEVALUATION",
      "TFP_SPLITTING"
    ],
    "priority": 53,
    "version": "v0.6.0_ru_tfp_stack"
  },
  {
    "entry_id": "STACK_CORE_00018",
    "match_type": "phrase",
    "surface_form": "с идеализированным",
    "normalized_form": "с идеализированным",
    "language": "ru",
    "candidate_concept_ids": [
      "TFP_IDEALIZATION",
      "TFP_SPLITTING"
    ],
    "priority": 53,
    "version": "v0.6.0_ru_tfp_stack"
  },
  {
    "entry_id": "STACK_CORE_00019",
    "match_type": "phrase",
    "surface_form": "идеализированных и",
    "normalized_form": "идеализированных и",
    "language": "ru",
    "candidate_concept_ids": [
      "TFP_IDEALIZATION",
      "TFP_SPLITTING"
    ],
    "priority": 52,
    "version": "v0.6.0_ru_tfp_stack"
  },
  {
    "entry_id": "STACK_CORE_00020",
    "match_type": "phrase",
    "surface_form": "идеализированных предшественников",
    "normalized_form": "идеализированных предшественников",
    "language": "ru",
    "candidate_concept_ids": [
      "TFP_IDEALIZATION",
      "TFP_SPLITTING"
    ],
    "priority": 52,
    "version": "v0.6.0_ru_tfp_stack"
  },
  {
    "entry_id": "STACK_CORE_00021",
    "match_type": "phrase",
    "surface_form": "идеализированных предшественников супер",
    "normalized_form": "идеализированных предшественников супер",
    "language": "ru",
    "candidate_concept_ids": [
      "TFP_IDEALIZATION",
      "TFP_SPLITTING"
    ],
    "priority": 52,
    "version": "v0.6.0_ru_tfp_stack"
  },
  {
    "entry_id": "STACK_CORE_00022",
    "match_type": "exact",
    "surface_form": "обесценить",
    "normalized_form": "обесценить",
    "language": "ru",
    "candidate_concept_ids": [
      "TFP_DEVALUATION",
      "TFP_SPLITTING"
    ],
    "priority": 51,
    "version": "v0.6.0_ru_tfp_stack"
  },
  {
    "entry_id": "STACK_CORE_00023",
    "match_type": "phrase",
    "surface_form": "примитивная идеализация",
    "normalized_form": "примитивная идеализация",
    "language": "ru",
    "candidate_concept_ids": [
      "TFP_IDEALIZATION",
      "TFP_SPLITTING"
    ],
    "priority": 51,
    "version": "v0.6.0_ru_tfp_stack"
  },
  {
    "entry_id": "STACK_CORE_00024",
    "match_type": "phrase",
    "surface_form": "и обесценивание",
    "normalized_form": "и обесценивание",
    "language": "ru",
    "candidate_concept_ids": [
      "TFP_DEVALUATION",
      "TFP_SPLITTING"
    ],
    "priority": 50,
    "version": "v0.6.0_ru_tfp_stack"
  },
  {
    "entry_id": "STACK_CORE_00025",
    "match_type": "exact",
    "surface_form": "идеализированный",
    "normalized_form": "идеализированный",
    "language": "ru",
    "candidate_concept_ids": [
      "TFP_IDEALIZATION",
      "TFP_SPLITTING"
    ],
    "priority": 50,
    "version": "v0.6.0_ru_tfp_stack"
  },
  {
    "entry_id": "STACK_CORE_00026",
    "match_type": "exact",
    "surface_form": "обесцененным",
    "normalized_form": "обесцененным",
    "language": "ru",
    "candidate_concept_ids": [
      "TFP_DEVALUATION",
      "TFP_SPLITTING"
    ],
    "priority": 50,
    "version": "v0.6.0_ru_tfp_stack"
  },
  {
    "entry_id": "STACK_CORE_00027",
    "match_type": "exact",
    "surface_form": "обесценивает",
    "normalized_form": "обесценивает",
    "language": "ru",
    "candidate_concept_ids": [
      "TFP_DEVALUATION",
      "TFP_SPLITTING"
    ],
    "priority": 50,
    "version": "v0.6.0_ru_tfp_stack"
  },
  {
    "entry_id": "STACK_CORE_00028",
    "match_type": "phrase",
    "surface_form": "эротическая идеализация",
    "normalized_form": "эротическая идеализация",
    "language": "ru",
    "candidate_concept_ids": [
      "TFP_IDEALIZATION",
      "TFP_SPLITTING"
    ],
    "priority": 50,
    "version": "v0.6.0_ru_tfp_stack"
  },
  {
    "entry_id": "STACK_CORE_00029",
    "match_type": "phrase",
    "surface_form": "и идеализации",
    "normalized_form": "и идеализации",
    "language": "ru",
    "candidate_concept_ids": [
      "TFP_IDEALIZATION",
      "TFP_SPLITTING"
    ],
    "priority": 49,
    "version": "v0.6.0_ru_tfp_stack"
  },
  {
    "entry_id": "STACK_CORE_00030",
    "match_type": "exact",
    "surface_form": "обесцененные",
    "normalized_form": "обесцененные",
    "language": "ru",
    "candidate_concept_ids": [
      "TFP_DEVALUATION",
      "TFP_SPLITTING"
    ],
    "priority": 48,
    "version": "v0.6.0_ru_tfp_stack"
  },
  {
    "entry_id": "STACK_CORE_00031",
    "match_type": "exact",
    "surface_form": "обесцениванием",
    "normalized_form": "обесцениванием",
    "language": "ru",
    "candidate_concept_ids": [
      "TFP_DEVALUATION",
      "TFP_SPLITTING"
    ],
    "priority": 48,
    "version": "v0.6.0_ru_tfp_stack"
  },
  {
    "entry_id": "STACK_CORE_00032",
    "match_type": "exact",